[
  {
    "opsAccount": "rHhr2iRBgp3ZzzNH4YGQ59G7VAiGPEWj7f",
    "jurisdiction": "US-CA",
    "url": "https://registry.example.org/lawyer/123",
    "evidence": "DQ0NDQ0NDQ0NDQ0NDQ0NDQ0NDQ0NDQ0NDQ0NDQ0NDQ0NDQ0NDQ0NDQ0NDQ0NDQ0NDQ0NDQ0NDQ0NDQ0NDQ0NDQ0NDQ0NDQ0NDQ0NDQ0NDQ0NDQ0NDQ0NDQ0NDQ0NDQ0NDQ0NDQ==",
    "barNumber": "CA-123456",
    "status": "active"
  }
]
